title,href,body
Corals For Sale in Australia | Ocean Reefs Marine Aquariums,https://oceanreefsmarine.com.au/collections/wysiwyg-coral,"Rusty Morph 2 Polyps. Populate your reef tank with live corals available to buy online. Browse from a wide range of WYSIWYG LPS corals, SPS coral, Soft corals and Zoanthids for sale. Coral Frags and coral colonies for sale | Fast shipping is available Australia-wide."
UK Online Sports Betting & Odds | Coral.co.uk,https://myaccount.coral.co.uk/en/menu,"Betting odds are a crucial aspect of online sports betting, as they help you determine the potential payout of your bet. In the UK, odds are typically displayed in fractional format (e.g., 5/1 or 2/7). The numerator (the first number) represents the potential profit, while the denominator (the second number) represents the amount you need to ..."
"Marshalls Official Site | Shop Shoes, Clothing, Home Decor & More",https://www.marshalls.com/us/store/index.jsp,"Free Shipping on $89+ Orders. Shop for brands that wow at prices that thrill. Find shoes, clothing, home decor, handbags & more from designers you love."
"LiveAquaria | Quality Aquarium Fish, Supplies & Equipment",http://liveaquaria.com/,"Find both the highest-quality aquatic life AND aquarium supplies for purchase at one convenient online location. LiveAquaria offers aquarium hobbyists the best shopping experience possible, with a trusted selection of freshwater and marine fish, corals, reef rock, invertebrates, live plants, AND quality aquarium supplies. . . all at great prices!"
Is it legal to sell coral? - able2know,https://able2know.org/topic/178679-1,"That might clarify the law and produce some leads. I would assume that the shops have a license, jcboy, and that's how they get to sell it. It sounds like a lot of the coral being sold is what they call ""cultured coral"" which I guess means that it was grown to be sold instead of being taken from the ocean. 0 Replies."
Leading 10 retailers in the UK 2023 | Statista,https://www.statista.com/statistics/462863/leading-ten-retailers-by-sales-uk/,"Nov 21, 2023. The United Kingdom's leading retailers were supermarket chains, with Tesco ranking at the very top based on its annual sales of approximately 39.7 billion British pounds for 2022/ ..."
What online coral store is best? | REEF2REEF Saltwater and Reef ...,https://www.reef2reef.com/threads/what-online-coral-store-is-best.1015362/,"Rating - 0%. 0 0 0. Austin Aqua Farms has great prices for larger pieces. The vast majority of online sellers just buy wholesale colonies and chop them up and sell for huge profits. Bonus points if they give them some ""ultra indo"" designer name to reel in the newbies/suckers. fishdoctor SpyC Cichlid Dad. Oct 27, 2023."
"Buy Seashells, Starfish & Coastal Decor • Sage, Rocks & Crystals ...",https://www.caseashells.com/,"Shop our low prices for seashells, starfish, sage & crystals, beach & coastal decor, wedding favors, based in Huntington Beach, California. ... Coral Chunks Natural dried broken coral chunks. Choose from a variety of sizes of coral chunks to add to decorative seashell vases, centerpieces and other beach decor crafts. ... RETAIL STORE: 125 Main ..."
Corals Unlimited | Maine's Aquarium Store and Maintenance Service,https://coralsunlimited.com/,"Our aquarium store has a large selection of corals, freshwater and saltwater fish. We also offer our Aquarium Maintenance Service for both residential and commercial clients. Stop by, or give us a call at (207) 406-4204. ... Topsham, Maine Retail Store & Service. Corals Unlimited. 49 Topsham Fair Mall Rd. ste. 20. Topsham, Maine 04086 (207) 406 ..."
Lands' End | Customer Service | Store Locator,https://www.landsend.com/co/storelocator,"Shop Lands' End for Women's Swimwear & quality clothing for the whole family. Women's Apparel, Men's Apparel & Kids' Clothing for all seasons. Outerwear & Footwear, too."
Store Locator and Retail Locations | Find OluKai Near Me,https://olukai.com/pages/store-locator,"REI. 1466 North Halsted St. Chicago, IL 60642. United States. 312-951-6020. Find Olukai Sandals, Shoes, Boots, and Slipper Stores Near Me Using The OluKai.com Store Locator Tool. Find OluKai Mens & Womens Footwear Near Me."
"High-Quality Coral, Fish & Aquarium Supplies | TheCoralShop",https://thecoralshop.com.au/,"The Coral Shop is located at unit 14/14 Rothcote court, Burleigh Heads QLD 4220. Hours: Mon: 8:30am-4pm. Tues-Weds & Fri: 10am-5pm. Sat: 10am-3pm. Sun & Thurs: Closed. The Coral Shop offers high-quality corals, fish & aquarium supplies. Shop SPS corals, LPS corals, fish, invertebrates, and more. Order online or visit us!"
Here's the full list of high street stores closing in 2024 - Time Out,https://www.timeout.com/uk/news/heres-the-full-list-of-high-street-stores-closing-in-2024-010224,Argos plans to close 100 UK sites in 2023 and 2024 as it focuses on expanding its presence in supermarkets instead of the high street. Over the last 12 months it has closed 45 shops but opened up ...
Ladbrokes/Coral must sell around 350 to 400 shops for clearance,https://www.gov.uk/government/news/ladbrokescoral-must-sell-around-350-to-400-shops-for-clearance,"Ladbrokes plc (Ladbrokes) and Gala Coral Group Limited (Coral) are, respectively, the second and third largest retail bookmakers in the UK by number of betting shops, known as licensed betting ..."
Faversham Marines,https://favershammarines.co.uk/,"Faversham Marines. With 30 years experience in the hobby and aquaculturing corals for the last 15 years, Our policy is, if we can't keep it and grow it long term then we won't sell it. Some of our corals have been in our systems for 20 years. Our SPS colonies are now 15th generation so are aquarium hardened. With over 80 SPS species and ..."
Coral - The Ultimate Review of the Trademark UK Bookie,https://www.bestbettingsites.com/uk/coral/,Bet£5 Get £20: The Welcome Bonus Explained. Coral's welcome offer is a thing of beauty. It is truly astonishing the value you receive and is one of the best there is on the market. Some of you may be familiar with Ladbrokes and may be wondering why they are so similar in terms of offers.
"TOP 10 BEST Coral Reef Store in Houston, TX - Yelp","https://www.yelp.com/search?find_desc=coral+reef+store&find_loc=Houston,+TX","See more reviews for this business. Top 10 Best Coral Reef Store in Houston, TX - December 2023 - Yelp - Oceanlife Aquariums, Galactic Coral, FJW Aquarium, 360 Aquatic, Paradise Fish and Pets, T&T Fish and Reef, That Aquarium Place, Infinity Fish, Nemo & Friends Aquariums, Aquarium Design Group."
"Affordable Premium Corals for your Reef Aquarium. SPS, LPS, Soft corals ...",https://mailordercorals.com/,"With over 10 years in the online coral market, we always aim to offer you the very best in customer service and all our livestock comes with our mailordercorals.com live arrival guarantee, so whether you are a complete novice starting out or an old seasoned reefer, we know you will find something that interests you from our ever expanding range of corals, critters and other livestock for your ..."
"Marine Fish, Live Rock and Corals | Rock 'N' Critters",https://www.rockncritters.co.uk/,"We are the UK's number one marine specialists, with a range of live rock, corals and fish for sale. Buy online today! Free Delivery On dry goods over £100. Price Match Promise We will beat any competitor. Speak to an expert 01446 737210. Visit our showroom Feel free to visit us!"
Women's Clothing & Accessories | Coast,https://www.coastfashion.com/,"Welcome to Coast, where effortless, everyday pieces combine for a curated wardrobe you'll love. Explore our latest collections and discover hard-working, elevated feminine designs for busy moments and non-stop schedules. Signature florals, art-inspired prints, trending colours and considered details breathe life into midi dresses, jumpsuits and ..."
Toronto's Best Aquarium Store and Saltwater Corals - Frag Box Corals,https://fragbox.ca/aquarium-store/,588 Marlee Ave. Toronto . M6B 3J5. Our reef aquarium store in open to the public and located in central Toronto just minutes away from the 401. You can get directions to our aquarium shop by following this link. please contact us if you need more information. Or we can be reach at 416-265-8481.
The Shops of Princess - Princess Cruises,https://www.princess.com/en-us/ships-and-experience/onboard-experience/activities/shopping,"The Essence shops provide our guests a unique and inviting environment that features top brands such as Chanel, Estee Lauder, Lancome and Dior. Shop across a broad range of product categories, including skincare, color, fragrance and body. Our onboard professionals have extensive training in product and application techniques."
Coral | Lakeside Shopping Centre,https://lakeside-shopping.com/stores/coral,"Established in 1926, Coral is one of the UK's biggest bookmakers. We have shops across the country and a dedicated website at coral.co.uk, offering sports betting, slots, table games, poker and bingo. With our industry-leading Coral Connect card, you have the ability to deposit and withdraw money in shops, and play online alongside a host of ..."
(UK) Help/advice with selling corals : r/ReefTank - Reddit,https://www.reddit.com/r/ReefTank/comments/12vjj14/uk_helpadvice_with_selling_corals/,A friendly place to discuss and show off all things saltwater aquarium related!
Store Locator | Virgin Media,https://store.virginmedia.com/sim-store-locator.html,"We've got an incredible range of phones and phone plans fit for every budget, so while you're in why not have a peruse. We do broadband. and TV too…. We're pretty good at it as well! With broadband, TV and phone bundles crafted for all tastes, our in-store team can help find the perfect fit for you. Find your nearest store."
Buy Corals for your Aquarium - Delta Aquarium UK,https://deltaaquarium.co.uk/corals/,"DELTA AQUARIUM SPECIALISE IN SELLING TOP QUALITY CORALS IN THE UK - DELIVERED SAFELY TO YOUR DOOR BY US. We hope you enjoy browsing our stock and find something special for your reef. We have a wide selection of soft corals, LPS & SPS corals…with some amazing deals in our £10 bay. Either click on the species tab above, or scroll down to ..."
Saltwater Aquarium Store in Winter Park | World Wide Corals,https://worldwidecorals.com/pages/winter-park,"Come visit our newest saltwater coral and aquarium supply store in Winter Park. Just like our parent store located in Orlando, you'll be able to see some amazing show tanks, talk with our aquarium pros, and shop for all the supplies you could ever want. WWC WINTER PARK LOCATION. 1909-A Aloma Ave. Winter Park, FL 32792. 407-755-5050."
Coral (bookmaker) - Wikipedia,https://en.wikipedia.org/wiki/Coral_(bookmaker),"The UK Government, however, ordered Ladbroke to sell Coral after the Monopolies and Mergers Commission found that the acquisition was anti-competitive. The Coral business, except for 59 shops in Ireland and Jersey, was sold in a management buyout financed by Morgan Grenfell Private Equity for £390 million in February 1999."
6 Best Places to Sell Coral Online - light.fish,https://light.fish/blog/6-best-places-to-sell-coral-online,"Selling Coral Online Hobbyists looking to sell their coral online should be well-versed in the best approaches to packing and shipping, and should monitor the weather conditions and travel time between the shipment's origin and destination.. High-quality imagery, detailed descriptions, and a favorable online presence can turn this money-making side business into a full-blown enterprise, like ..."
Kraken Corals Reviews | Read Customer Service Reviews of krakencorals.co.uk,https://uk.trustpilot.com/review/krakencorals.co.uk,Brilliant shop. Brilliant shop. Started my first nano marine tank and they advised me on what to put in. Spent lots of time searching shop for blue legged hermit crabs as thats the colour i wanted and they thought they had a couple. Very knowledgeable about corals and helped me pick 2 starter ones to see how i go with them.
The Reef Aquarium Shop,https://www.thereefindy.com/,"The Reef Aquarium Shop 5613 North Keystone Avenue Indianapolis, IN, 46220 United States 317-253-9695"
CommunityCorals - The online marketplace for captive corals,https://www.communitycorals.net/,"Community Corals is an online marketplace for aquarium-grown offspring corals, where various private and commercial coral breeders and nature-conscious coral lovers come together to make a contribution to protecting natural reefs and to enjoy the common hobby. Buyers will find a wide selection of sustainably farmed corals at a fair price."
"Coralwood Mall Clothing Store in Cape Coral, FL | Bealls Florida",https://stores.beallsflorida.com/fl/capecoral/department-store-19.html,"STE 9. Naples, FL 34110-6538. Get Directions. (239) 254-1192. 508,872. Verified Ratings. Services Available: In-Store Pickup. Visit our Bealls Florida store in Cape Coral, FL for clothing for the whole family, shoes, sandals, and coastal-inspired home decor."
Coral Bet Tracker & Cash Out Bet Slips Explained - Betting Institute,https://www.bettinginstitute.co.uk/how-to-bet/coral-bet-tracker-cash-out/,"Last updated Dec 21, 2023 0. You can check and cash out a paper bet slip in a Coral shop - after all, Ladbrokes Coral's network is present all across the UK & Ireland, - but the more convenient way is to do it online. If you're already a betting account holder, you can do it via the sportsbook. Otherwise, you'll have to access a ..."
The UK's 50 most fabulous independent shops,https://www.theguardian.com/lifeandstyle/2021/nov/28/the-uks-50-most-fabulous-independent-shops,"Started by husband-and-wife Janet and Sean Bell in 2007, Beaumaris-based Janet Bell Gallery & Lifestyle Store sells original acrylic and watercolour artworks by Janet, depicting the sweeping ..."
World Wide Corals Superstore | Orlando Aquarium Store,https://worldwidecorals.com/pages/wwc-orlando-superstore,"5402 Central Florida Pkwy. Orlando, FL 32821. 407-856-2066. 7 days a week. 11am - 7pm. Get directions."
Koral King: Rare Corals for Sale,https://koralking.com/,"+1 (352) 579-8888. contact@koralking.com. 4445 SW 35th Terrace, Suite 280 Gainesville, FL 32608 Mon: CLOSED Tues - Sat: 10am - 7pm Sun: 10am - 6pm All coral pictures are taken under Radion XR15 G5 Blues with 100% UV, Violet, Royal, Blue, and Point Intensity"
Live Coral Sales Online | Buy Corals | Pieces of the Ocean,https://www.piecesoftheocean.com/,"September 06, 2023. Pieces of the Ocean offers an unbeatable selection of live corals for sale online. Join our weekly auction on ReefnBid.com to discover new corals at great prices. High-end acro grower with collection cut-to-order. Backed by 14-Day Guarantee."
"Reef-Corner , Europes largest coral and fish store",https://reef-corner.com/,Verbindingsstraat 4A 3670 Neerglabbeek Belgium; support@reef-corner.be; Belfius BE24 0689 3843 7338 BIC: GKCCBEBB
Coral For Sale | Purchase Aquaculture Products Online - Pacific East ...,https://pacificeastaquaculture.com/,"Pacific East Aquaculture has been the main Aquaculture Store for many aquarist looking for live corals for sale for the last 22 years. Shop our huge collection of aquacultured coral for sale. Purchase live frags, coral colonies and so much more for you reef aquarium. ... Our Retail Store is open for walk in customers Saturdays Only from 11AM ..."
Australian Coral Supllier | Premium Coral Supplier - Ultra Coral Australia,https://ultracoralaustralia.com/coral-supply/,"Ultra Coral Australia is your number one choice for premium Australian corals. With decades of experience in coral husbandry and a true passion for what we do, UCA offers a supply chain solution for coral retailers and wholesalers worldwide. Our team is proud to deliver a seamless diver to doorstep experience of stunning Australian LPS and SPS ..."
Coral Buying Guide for Beginners - Reefs.com,https://reefs.com/magazine/coral-buying-guide-beginners/,"Coral Buying Guide for Beginners - By Austin Lefevre You're considering getting into the reef keeping hobby. ... With many aquaculture farms growing coral at breakneck speeds, a 2″ frag of ""green bali slimer acro"" would likely sell for $50. A maricultured 4″ piece would be about the same, where $50 for a wild collected piece could fetch ..."
Ten UK farm shops that are a must-visit | House & Garden,https://www.houseandgarden.co.uk/gallery/best-farm-shops,"As well as championing their own produce, Farm Shop also celebrates both emerging and established local artisans from the south west region. Whatever you pop in for, you'll leave with armfuls more. Farm Shop Somerset, Dropping Lane, Bruton, BA10 0NL. 64 South Audley Street, London, W1K 2QT. dursladefarmshop.co.uk/. 2/10."
The farm shops of London | Britain Magazine,https://www.britain-magazine.com/london-lifestyle/the-farm-shops-of-london/,"Less a classic grocers, more a gourmet concept store, the two-storey, 400-square-foot space is the second UK farm shop from ARTFARM, the independent hospitality group behind delights from food-driven Scottish hideaway The Fife Arms to Mayfair's own Audley Public House and Mount Street Restaurant. Going gourmet ARTFARM"
Home - UK Farm Shop Guide,https://ukfarmshopguide.co.uk/,The UK Farm Shop Guide is delighted to feature the winner of National Farm Retail Association Awards Best National Large Farm Shop of the Year 2023…Strawberry Fields 🍓. Started over 25 years ago by Jo and Roger Mounce on a 2 acre patch just outside Lifton on the borders of Devon and Cornwall it is now a thriving restaurant and farm shop ...
Home - Wholesale Tropicals - Tropical & freshwater fish,https://wholesaletropicalsaquatics.co.uk/,"We cater to all tastes in freshwater aquariums. From the smallest to the largest, also including planted aquariums. Visit our store or give us a call on 020 7739 5356 to find out more. Wholesale Tropicals - We have an excellent variety of tropical & freshwater fish in large aquariums in Bethnal Green, East London."
Wholesale Flowers - grown fresh on our farm - Flower & Farmer,https://www.flowerandfarmer.com/wholesale-flowers/,"Come summer, our fields and polytunnels are bursting with Sweet Peas, Foxgloves, Roses, Peonies, Phlox and Larkspur (to name but a few). As the season progresses, our selection includes Dahlias, Cosmos, Amaranthus, Zinnias and Echinacea. We grow a range of shrubs for foliage so that, in time, we should have a healthy supply of foliage year round."
The best farm shops in the UK | Tatler,https://www.tatler.com/article/best-farm-shops-uk,"2) Bodnant. North Wales. Alamy. Come here, to Furnace Farm in Tal-y-Cafn, north Wales, for good Welsh cheese - think crumbly Caerphilly. Also a hard, white smoked cheese called Abermwg, which you can only buy if you can pronounce it ('aber-moog'). Tucked behind the farm shop is a small but well-stocked wine shop."
Fairygoodies Fairy Shop | UK Fairy Products Retailer,https://www.fairygoodies.co.uk/,"At Fairygoodies we offer imaginative, high quality fairy themed products to suit all budgets and needs! As well as our own designed ranges, we bring you a wide range of fabulous fairy goodies from other creative people. Whether you need wings, fairy dust or miniature garden products, we can help, with quick delivery and friendly service!"
Guide to selling fish online - Ornamental Fish,https://ornamentalfish.org/what-we-do/set-standards/selling-fish/selling-fish-online/,Key things to remember when buying/selling fish online: Live fish are prohibited from being sent by Royal Mail. Only approved couriers can carry live fish and no-one should buy fish from a seller who says they will send their fish through the normal post. A firm date and time for delivery should also be established and someone over the age of ...
25 best plant shops in London - Potting Around,https://www.pottingaround.com/inspiration/best-plant-shops-in-london/,"In addition to a large selection of indoor and outdoor plants, the store also stocks trees, shrubs, sculptures, gazebos and garden furniture to cater to the needs to all kind of gardeners. For more information, visit worldsendnurseries.com. 441-457 King's Rd, Chelsea, London SW10 0LR. 14."
The UK's 50 most fabulous independent shops,https://www.theguardian.com/lifeandstyle/2021/nov/28/the-uks-50-most-fabulous-independent-shops,"Alongside the luxurious local spa goodies, candles and diffusers, Adams delights in British-grown, fresh-cut flowers, plastic-free floral design and ""spending time curating our brand to service ..."
8 8 Of London's Best Farm Shops (And Veg Boxes) - The Handbook,https://www.thehandbook.com/london-guidebook/londons-best-farm-shops-and-veg-boxes/,"Dine while you shop at Farm W5. This quaint farm shop delivers on fresh, seasonal produce and delicious bites to eat, perfect for a quick grab and go lunch. Sharing their farm-to-table approach with all who waltz through their doors, Farm W5 guarantees their food is fresh, wholesome and free from added sugar, preservatives and gelatine."
43 Norfolk Farm Shops for Amazing Local Produce!,https://norfolktravelguide.co.uk/norfolk-farm-shops/,"The farm shop is an outlet for all their locally grown produce, with most coming directly from the farm. Pop in to buy farm fresh vegetables, eggs, preserves, pickles, chutney and honey, apple juice, seasonal fruit, and knitwear made from Clinks' sheep fleeces! Church Road, Toft Monks, Beccles NR34 0ET."
All Greens - All Greens Wholesale Ltd,https://allgreens.co.uk/,"Wholesale. We supply a huge variety of fresh, seasonal produce to chefs across some of London's best restaurants and hospitality venues. Why not open an account with us today? Open an account. All Greens is one of the UK's leading retailers, wholesaler and importer of fruit, vegetables and exotic produce with four stores in London as well ..."
"Evergreen Organics - Wholesale Organic Produce, London and South of UK",https://www.evergreenorganics.co.uk/,"aboutus. Evergreen Organics is a leading organic wholesaler and importer of organic fresh fruit and vegetables with premises in London and Bristol, supplying the South of England for over 20 years. As much as possible our produce is sourced from local growers when in season, but we also import from growers in Europe and further afield to bring ..."
The Japanese Shop | Japanese Gifts | Japanese Products,https://thejapaneseshop.co.uk/,"The Japanese Shop is number 1 for unique Japanese gifts and products. Browse and order from one of the best collections of authentic Japanese gifts today! ... It is celebrated in tea rooms, cafes hotels and pubs across the UK, arguably the most British day of the year. The... Enjoy National Tea Day - Japanese Style! April 16, 2024. The 21st of ..."
Selling fish - OATA - The Ornamental Aquatic Trade Association,https://ornamentalfish.org/what-we-do/set-standards/selling-fish/,"Pet shops. All commercial businesses that sell vertebrate animals, such as fish, need to be inspected and licenced by their local authority. In England, Scotland and Wales these are now regulated by Animal Activities Licence regulations and require pet shops and other businesses which sell animals to meet mandatory standards."
Wholesale Spanish Cleaning Products - Lemon Fresh UK,https://www.lemonfreshuk.com/wholesale/,"You can call us directly Monday - Friday, between 9am - 5pm on 01375 800987 (Option 2). Lemon Fresh UK Ltd are one of the largest independent Spanish cleaning product suppliers in the United Kingdom. We are based in Essex and wholesale Spanish cleaning products such as Asevi, Nenuco and other top Spanish cleaning brands."
Everything to Know About Selling in the United Kingdom,https://www.faire.com/blog/selling/selling-in-the-united-kingdom/,"February 7, 2021 | Published by Faire. At Faire, one of our primary goals is to connect brands with local retailers in new markets. That's why we're excited to expand the Faire marketplace to serve independent retailers across Europe in 2021 and beyond. Our first stop is the United Kingdom. A limited number of U.K. retailers can now shop on ..."
"Willow Tree - Chicken Salads, Chicken Pies, and Chicken Dips",https://willowtreefarm.com/,"In addition to our own products, we also stock a full deli with cold salads, cold cuts, fresh poultry, hot food items, fresh baked pies, milk, eggs, grocery items, snacks, beverages and more. Learn More About Our Store ... 👉 Find our NEW Willow Tree Snack Packs at your local supermarket or head down to our Retail Store located at 997 South ..."
Why BRP - Black River Produce,https://blackriverproduce.com/why-brp/,"Call our Transportation Department at 802-886-6280 to let us help you scale your business to reach more New England customers. Black River Produce is a Vermont-based, food distribution company focused on locally produced and sustainably farmed foods."
In pictures: The 11 best store openings of 2022 - Retail Gazette,https://www.retailgazette.co.uk/blog/2022/12/best-store-openings-2022/,"Battersea Power Station opened to much fanfare in October, Battersea Power Station after a major £9 billion 10-year project. The station, which was decommissioned back in 1983, is now filled with ..."
Online Plant Shops In Spain To Satisfy Your Green Fingers,https://www.ohlaliving.com/online-plant-shops-in-spain,"Why not check out these 20 online plant shops in Spain that sell a wide range of indoor and outdoor plants that suits every taste. ... Barcelona it was founded in 1988 as a Mediterranean ornamental plant nursery. In 1992 they expanded to a large garden centre and have a total of 4,500 m2 covered and 15,000 m2 of crops and accessories for ..."
