title,href,body
Cellar Marine Aquatics,https://www.cellarmarinestore.co.uk/,"Stocking a huge range of top quality healthy marine fish, corals and critters. We offer a vast range of brands and products for all your aquarium needs. From lighting, to pumps, to foods, to medicines and so much more. ... The UK's number 1. family friendly aquatics store. specialising in saltwater aquarium supplies. VAT No: 339572764 Company ..."
"Marine Reef Aquarium Fish, Corals and Invertebrates",https://www.e-marineaquatics.co.uk/,"We strive to be the most trusted and knowledgeable marine aquatics retailers in the South East. Dedicated to providing the latest products, outstanding customer service, great value for money and most importantly quality marine livestock. We're proud to hold a 5-star pet shop licence. License No. A04005682. About us."
Marine Fish For Sale UK | Finest Aquatics,https://www.finestaquatics.co.uk/livestock/marine-fish,Shop a wide range of live marine fish for sale online with Finest Aquatics. We are a reputable UK supplier with over 200 saltwater aquariums in our facility - you will be spoilt for choice with our selection of livestock for your reef or fish only aquarium. ... Email: sales@finestaquatics.co.uk. Visit Our Retail Store: Unit 16 Montague Road ...
Just Marine Aquatics Ltd - Marine Aquarium Fish and Corals Bolton,https://www.justmarines.co.uk/,We have some stunning fish in stock and amazing corals at brilliant prices. Quick View. Red Jaw fish. £ 40.75. Quick View. Vampire Tang. £ 48.50. Quick View. Scopas tang.
corals for sale sussex| marine fish for sale east sussex| corals East ...,https://www.sussexcorals.com/,"marine aquatics store, based in east sussex, selling cultured corals, marine fish and marine dry goods. ... Full service marine retail store, five star reviews with excellent customer service and high quality marine live stock and dry goods. ... We sell more than just corals, we also sell marine fish and invertebrates. Livestock . Receive ..."
Buy Marine Fish Online | Marine Aquarium Fish Delivered To Your Door,https://universalaquatics.co.uk/product-category/livestock/marine-fish/,Livestock Delivery - £24.99 - Wednesday-FridayLive Plants / Live Food (£4.99)*Please Note - Drystock orders can take upto 7-14 Days*. Home / Livestock / Marine Fish.
The Aquatic Store - FREE SHIPPING ON UK ORDERS OVER £50,https://www.theaquaticstoreonline.co.uk/,"0117 9639 120. THE AQUATIC STORE BRISTOL. Fish guarantee Policy. We care about the health and quality of our livestock and have invested in individually filtered aquariums rather than a large, centralised system where the tanks are connected."
Aquariums | Tropical Fish | Marine Fish - Aquahome,https://www.aquahome.co.uk/,"Our extensive range of tropical fish includes tetras, barbs, loaches, angels, African cichlids and sharks whilst in our pond fish section you will find fish such as shubunkins, koi, sarasa comets, tench, orfe, sturgeons and, of course, numerous varieties of goldfish too. As well as our large range of fish we have a great selection of marine ..."
"Tropical fish, Marine fish, Cold Water fish & Corals search",http://www.tropicalfishfinder.co.uk/shops.asp,"Tropical Fish Finder.co.uk - The ultimate UK fish keeping resource for all types of tropical and marine fish, including fish books, articles, fish shops, fish clubs and more. Buy Tropical Fish Online - Tropical Fish Shop - info@tropicalfishfinder.co.uk. Price Match Guarantee - ☆☆☆☆☆ 4.8 Star Review Rating ..."
"Tropical, freshwater, marine and pond supplies - Fast Free UK Shipping ...",https://cdlaquatics.co.uk/,"Fluval Plant Straight Forceps 27cm (10.6in) £8.22. Fluval Plant Gro+ 120ml. £7.70. Fluval Plant CO2 Ceramic Diffuser with Suction Cup. £8.95. CDL Aquatics are an independent, family run business and a leading UK online retailer of Marine, Tropical, Coldwater and Pond Supplies. Free UK Delivery."
A&M Aquatics - Wholesale Marine Fish & Supplies,https://www.amaquatics.com/,The A&M Aquatics Advantage. 100% Live Arrival Guarantee. Average Fill Rate Exceeds 93%. No Substitutions. Fish Are Accurately Sized. Live Online Ordering System. Why Choose.
Fish and seafood in the UK - statistics & facts | Statista,https://www.statista.com/topics/7948/fish-and-seafood-in-the-uk/,"Seafood retail in the UK As of 2022, there were 1,265 UK enterprises that specifically sold fish, crustaceans, and mollusks. There was an ongoing downward trend since 2008, however, from 2019 ..."
Marine Fish and Coral Supplier-Buy Online-Aquatics To Your Door,https://www.aquaticstoyourdoor.co.uk/product-category/marine-saltwater/marine-fish-saltwater/,"Marine Fish. Marine Fish (Saltwater) We are able to offer a huge range of Marine fish for sale online, including Invertebrates, live rock and Corals. If you cannot find what you are looking for then please let us know and we can order most fish in. Most of our fish are now available to pre-order if they are listed as out of stock."
"Aquarium Fish Depot - Fish Store, Saltwater & Freshwater Fish, Corals",https://aquariumfishdepot.com/,"Our warehouse is located in San Diego at 5121 Santa Fe Street, Suite F, San Diego, California 92109 and open to the public every day from 10:30 AM to 6:30 PM. Come and be inspired by an endless selection of saltwater and freshwater fish, corals, invertebrates, aquarium tanks, stands, supplies, aquascaping materials, and more!"
"TOP 10 BEST Saltwater Fish Store in Denver, CO - Yelp","https://www.yelp.com/search?find_desc=Saltwater+Fish+Store&find_loc=Denver,+CO","Top 10 Best Saltwater Fish Store Near Denver, Colorado. 1 . Aquatic Art. ""Chris, best in the business. Experienced in all facets of keeping a reef tank ."" more. 2 . Keepin It Reef. ""Friendly and knowledgeable staff! They have an incredible selection of corals and gear."" more."
Saltwater Fish: Marine Aquarium Fish for Saltwater Aquariums,https://www.liveaquaria.com/category/15/,"Marine Fish. No one offers a better selection of healthy marine fish for the saltwater aquarium than LiveAquaria®. From angels, to clownfish, gobies, tangs, wrasse and more... The finest specimens in the world are just a click away. Whether you're a beginner or a seasoned hobbyist, find quality aquatic life for marine aquarium when you shop ..."
Your Source for Saltwater Invertebrates & Fish | Reeftopia,https://reeftopia.com/,Saltwater Invertebrates and Reef Safe Fish for your Reef Aquarium. Get your aquarium livestock directly from the diver at an affordable price! Our Florida Keys location gives us the ability to deliver the best Marine Life possible. Buying Direct from the Florida Keys is an incredible advantage. All of our items are absolutely guaranteed.
Seafood dealer permits | Mass.gov,https://www.mass.gov/info-details/seafood-dealer-permits,"Retail Seafood Truck Dealer Permit : Allows you to sell fish or lobsters at retail from a mobile unit (does not include shellfish). Does not allow the holder to process, fillet, shuck, cook, etc. You need an inspection from a town or county Board of Health. You must submit a copy of the inspection with the application."
Fishkeeper Scotland opens flagship store in Edinburgh,https://www.practicalfishkeeping.co.uk/fishkeeping-news/fishkeeper-scotland-opens-flagship-store-in-edinburgh/,"The new store also stocks a wide range dry goods and offers a choice of over 200 aquariums, including the company's own AquaOak range. You can find it at Dobbies Garden Centre, Melville Nursery, Lasswade, Edinburgh, EH18 1AZ. Tel. 0131 663 9814. Opening times: Monday-Friday: 9:00am-7pm; Saturday-Sunday: 9am-6pm. Fishkeeper Scotland is ..."
P&P Aquarium - Thailand Export Tropical fish,https://ppaquarium.com/,"P&P Aquarium World Trading Company Limited, which specialized in export live freshwater tropical fish from thailand. Over 17 years experience in freshwater tropical fish industry. We have 900 glass tank of 70 liter water and 160 cement tank of 600 liter of water. Which support us to serve our customer with excellent quality fish aquarium with ..."
Perfect Aquatics,https://perfectaquatics.com/,"We are one of the UK's largest aquatics specialists. No matter if your passion lies in Koi, Marine, Tropical or Watergarden, our expert team are on hand to help. ... our expert team are on hand to help. Shop online now! Skip to content. Welcome to Perfect Aquatics, For The Joy of Koi - Free Delivery over £50* - 1000's of Products In-Stock ..."
Radical Aquatics Leeds - Aquarium | Marine fish and Coral,https://radicalaquatics.co.uk/,"info@radicalaquatics.co.uk. Search Search. Finance Available Via Klarna Checkout. FIND OUT MORE . Radical Aquatics. 150 Google reviews. Write a review. Simon Parker . 2023-05-27. ... Your one stop shop for Marine Fish and Aquarium Supplies, friendly, passionate team. OPENING TIMES. Monday: Closed."
Buyers and sellers of first-sale fish - GOV.UK,https://www.gov.uk/government/publications/buyers-and-sellers-of-first-sale-fish-and-submission-of-sales-notes/buyers-and-sellers-of-first-sale-fish,4. Register as a buyer or seller of fish. You can register as a buyer and/or seller of first-sale fish for free by completing the form RBS1. You will need to provide details of: you or your ...
Aquatic Design Centre,https://www.aquaticdesign.co.uk/london-aquarium-supplies/,"Marine Fish, Corals and Reef Invertebrates. We stock over 200 marine tanks full of fish, corals, and invertebrates. Largest UK retailer in coral frags. We also have several shipments each week from around the world and hundreds of locally farmed coral frags to choose from, our stock is continually replenished. ... Aquatic Retail Store: 020 7580 ..."
"TOP 10 BEST Saltwater Fish Store in Atlanta, GA - Yelp","https://www.yelp.com/search?find_desc=Saltwater+Fish+Store&find_loc=Atlanta,+GA","Top 10 Best Saltwater Fish Store in Atlanta, GA - May 2024 - Yelp - Southern Aquatics Local Fish Store, Nemo Aquarium, Atlanta Aquarium, Premier Aquatics, Reef Shac, The Fish Store, Optimum Aquarium, Pure Reef, Ani-Mart Pets"
Home | Pelagic Aquatics | Matfield,https://www.pelagic-aquatics.co.uk/,"For over 10 years, Pelagic Aquatics has been providing customers with quality tropical fish, marine fish, pond fish, reptiles, amphibians, and invertebrates, along with all their necessary equipment. With purpose built facilities, consisting of 200 tropical tanks, 75 marine tanks, 2 huge coral systems, 20 pond vats, 50 reptile vivariums, and a ..."
Leicester Aquatics | Tropical marine coldwater and pond fish,https://leicesteraquatics.com/index.php,"If you would like your tank to feature on our website then please email us. Leicester Aquatics - Leicester's largest stockists of fish, aquariums, fish food and other accessories. Call 0116 270 9610 for free, friendly advice."
Aquatic Design Centre,https://www.aquaticdesign.co.uk/,"Marine Fish, Corals and Reef Invertebrates. We stock over 200 marine tanks full of fish, corals, and invertebrates. Largest UK retailer in coral frags. We also have several shipments each week from around the world and hundreds of locally farmed coral frags to choose from, our stock is continually replenished. ... Aquatic Retail Store: 020 7580 ..."
"Aqua Imports - Rare Tropical Fish, Plants, Invertebrates, Reptiles and More",https://www.aqua-imports.com/,"Marine Fish, Invertebrates & Corals. We maintain over 2,500 gallons of saltwater aquariums and offer a wide variety of corals, invertebrates, and fish. From SPS to LPS, captive bred and wild collected marine fish and an extensive selection of invertebrates, our store is stocked with everything needed to populate your marine or reef aquarium."
Coral Reef Aquariums & Marine Aquarium Shops in the UK | Kraken Corals,https://krakencorals.co.uk/,"Kraken Corals is a well-established aquarium shop in Accrington, UK and an online retailer of marine supplies selling marine aquariums, marine care products, fish and coral food and much more.We stock a wide range of fish (available to buy instore), coral and big brand aquarium dry goods. If you can't find what you are looking for, our specialists will do their best to help you find the ..."
Freshwater Tropical Fish For Sale Online - The Wet Spot Tropical Fish,https://www.wetspottropicalfish.com/,"Our retail store is 5,000 square feet with over 400 individually-filtered freshwater tanks. We are home to more than 500 different species of tropical freshwater fish, and a myriad of aquarium supplies including: aquarium tanks, tank accessories, tubing, live and dry foods, supplements, medications, live plants, and more!"
Waterworld Aquatics Glasgow - Tropical & Marine Livestock,https://www.waterworldglasgow.com/,"About Waterworld Aquatics Glasgow. Providing aquarium fish, supplies and advice for tropical and marine aquatics to Glasgow for over 30 years. We stock a wide variety of tropical and marine livestock here at Waterworld Aquatics Glasgow and we specialise in providing first-class fish, plants and corals for our customers."
"TOP 10 BEST Saltwater Fish Stores in Boston, MA - Yelp","https://www.yelp.com/search?find_desc=Saltwater+Fish+Stores&find_loc=Boston,+MA","See more reviews for this business. Top 10 Best Saltwater Fish Stores in Boston, MA - May 2024 - Yelp - Love The Reef, Aquatic Treasures, All Things Aquatic, Tropic Isle Aquarium, Uncle Ned's Fish Factory, Easy Aquariums, Imagine An Ocean, Living Water Aquariums, Gibbons Aquaria, Petco."
"Marine Fish, Live Rock and Corals | Rock 'N' Critters",https://www.rockncritters.co.uk/,"We are the UK's number one marine specialists, with a range of live rock, corals and fish for sale. Buy online today! Free Delivery On dry goods over £100. Price Match Promise We will beat any competitor. Speak to an expert 01446 737210. Visit our showroom Feel free to visit us!"
The Reef Aquarium Shop,https://www.thereefindy.com/,"The Reef Aquarium Shop 5613 North Keystone Avenue Indianapolis, IN, 46220 United States 317-253-9695"
Home - Wholesale Tropicals - Tropical & freshwater fish,https://wholesaletropicalsaquatics.co.uk/,"We cater to all tastes in freshwater aquariums. From the smallest to the largest, also including planted aquariums. Visit our store or give us a call on 020 7739 5356 to find out more. Wholesale Tropicals - We have an excellent variety of tropical & freshwater fish in large aquariums in Bethnal Green, East London."
Exeter Aquatics - Cylex,https://exeter.cylex-uk.co.uk/company/exeter-aquatics-13332234.html,"AquaEssentials. 10.73 km. Details Website Accessories Cabinets. 2 Creedy Vale, Down End EX17 1HN Lords Meadow Industrial Estate 01363 774787. Map view of similar nearby companies. Check Exeter Aquatics in Exeter, Shaftesbury Road on Cylex and find ☎ 01392 219..., contact info, ⌚ opening hours."
"Home · Abyss Aquatics UK Based in Stockport, Greater Manchester.",https://www.abyssaquatics.co.uk/,"Unit 4,5 & 6 Brookside Estate Waterloo Road Stockport Greater Manchester SK1 3BD United Kingdom 0161 4764439 shop@abyssaquatics.co.uk"
"Aquarium store - Marine Fish Shop and Aquarium Supplies, Devon UK ...",https://www.reef-passion.co.uk/,"Hobbyist run marine aquarium store in Devon with a passion for all things reef tank related. We set up Reef Passion with the goal of being an oasis for the saltwater tank hobbyist. In store we sell a range of marine fish, corals and critters. We stock a wide variety of equipment and tank consumables, available both online and in store, many of ..."
Buy saltwater fish online - Aquatic shop - MasterFisch UK,https://www.masterfisch.co.uk/4-marine,"Masterfisch: Aquatic online shop for your aquarium. Buy marine and freshwater fish to bring your aquarium to life with over 2000 references at the best price. From discus fish to clownfish, choose among common and rare species, included invertebrates, corals and clams."
New Applicants | FWC - Florida Fish and Wildlife Conservation Commission,https://myfwc.com/license/commercial/saltwater/new-applicants/,Wholesale and retail dealers. A Wholesale Saltwater Products Dealer License (WD) is required to sell saltwater products to any customer except the consumer and to buy from persons holding an SPL or another licensed wholesale dealer in the counties specified on the license. Wholesale dealers must report purchases to the Commission when products are landed or sold for the first time.
Saltwater Fish for sale - Salty Underground,https://www.saltyunderground.com/6-saltwater-fish-for-sale,"Anthias Fish Aqua-cultured Marine Fish Beginner Marine fish Blennies Butterflyfish Cardinal Fish Chromis Clownfish Damselfish Dottyback Eels Gobies Jaw Fish Miscellaneous Marine Fish Nano fish Pipefish Tangs & Surgeons Triggers Waspfish Wrasse . 1/4"" Berghia Nudibranch available for immediate delivery. ... Store information. Salty Underground ..."
"THE BEST 10 Local Fish Stores in MIAMI, FL - Yelp","https://www.yelp.com/search?cflt=localfishstores&find_loc=miami,+fl","Not every store has that going for it."" See more reviews for this business. Best Local Fish Stores in Miami, FL - Ocean View Aquariums, Strictly Fish, Neighborhood Fish Farm, Exotic Aquariums, Neptunes Aquarium Store, Reeftop Aquariums, Miami Fish Garden And Hatchery, Exotic Aquatic, Arium Fauna & Flora, Ornamental Fish Imports."
"Sims Tropical Fish | Tropical Fish, Aquarium, Fish Store - Tropical ...",https://simstropicalfish.co.uk/,"From Vibrant Tropical Species to Captivating Cold Water Inhabitants and Majestic Marine Life, our inventory showcases the diversity of aquatic life. ... Ian Moon. 17:12 03 Mar 24. Sims is a great online fish store. I love my large and oddball fish. There selection is amazing. I have had 2 orders now placed my 3rd and have been happy with all my ..."
Salty Underground: The best online store for saltwater livestock,https://www.saltyunderground.com/,"Salty Underground is the online store for the saltwater aquarium hobbyist. We have a large selection of saltwater fish and other marine livestock for sale and always free shipping after $99. 1/4"" Berghia Nudibranch availability is expected mid June. BUY NOW. Call us: 314-756-2259"
World Wide Corals Superstore | Orlando Aquarium Store,https://worldwidecorals.com/pages/orlando-superstore,"Visit our Orlando location to view our spectacular show tanks and purchase all of your live coral, saltwater fish, inverts, and saltwater aquarium supplies. WWC ORLANDO LOCATION. 5402 Central Florida Pkwy. Orlando, FL 32821. 407-856-2066."
Selling fish - OATA - The Ornamental Aquatic Trade Association,https://ornamentalfish.org/what-we-do/set-standards/selling-fish/,"Pet shops. All commercial businesses that sell vertebrate animals, such as fish, need to be inspected and licenced by their local authority. In England, Scotland and Wales these are now regulated by Animal Activities Licence regulations and require pet shops and other businesses which sell animals to meet mandatory standards."
Cambridge - Maidenhead Aquatics - Fishkeeper,https://www.fishkeeper.co.uk/storefinder/cambridge/,"Free Express Delivery On orders over £39. some items have delayed dispatch and additional delivery costs as indicated on the product page . Click and Collect Now available in all our stores across the UK! Buy online and collect in-store or simply check stock availability. Shop now. Pay with Klarna.18+, T&C apply, Credit subject to status. Price Match Find any product cheaper elsewhere, we'll ..."
"Finest Aquatics - A leading supplier of tropical, marine and pond fish ...",https://www.finestaquatics.co.uk/,"Marine Foods. Coral Foods; Fish Food; Live Foods; Food Additives; Aquarium Plumbing. 20mm; 25mm; 32mm; 40mm; 50mm; Gift Cards; ... Finest Aquatics are an award-winning aquatic retail store in Widnes. We have an extensive online and physical store stocking a large range of Marine, Tropical and Pond products. ... sales@finestaquatics.co.uk. Visit ..."
Tropic Isle Aquarium - store,https://www.tropicisleaquarium.com/,"Stop in and see us to continue building or start your dream aquarium. 1 2 3. Our Store. 686 Worcester Rd, Rt. 9. East Framingham, MA 01702. Phone: (508) 875-5303. Email:Tiaquarium@gmail.com. Store Hours. Mon/Weds/Thurs/Sun."
Saltwater fish for sale online | Saltwater Fish store | Marine Fish for ...,https://www.saltwaterfishshop.com/,"SWFS is America's top online saltwater fish store . We offer plain and simple the largest selection of marine fish for sale online, at the best prices anywhere in the world. Shipping overnight via UPS to your doorstep, shopping at our online Saltwater fish store couldn't be easier. Shortly after placing your order for marine fish for sale ..."
AMC Aquatics | Tropical & Marine Fish Northern Ireland | Aquariums NI,https://amcaquatics.com/,"Northern Irelands premier tropical fish, marine & cold water aquarium outlet. Everything you need for your aquarium or pond. Friendly professional service. Skip to content. 02877769748 | [email protected] Main Menu. ... In-store we have two coral tables, totalling (300 gallons) are a comprehensive display of soft and hard corals. ..."
Coral Passion | Marine Livestock Specialist | Essex,https://coralpassion.co.uk/,"Coral Passion is a marine shop in Essex with some of the best quality marine fish , corals and invertebrates. We sell hard and soft coral colonies and frags, clams, and a selection of shrimps, snails, urchins and other 'clean up crew' to help keep your reef algae free. We also stock a selection of dry goods, like reef salts, flake foods ..."
"THE BEST 10 Seafood Markets in MANCHESTER, UNITED KINGDOM - Last ... - Yelp","https://www.yelp.com/search?cflt=seafoodmarkets&find_loc=Manchester,+UK","Top 10 Best Seafood Markets Near Manchester, Greater Manchester. 1 . Direct Fisheries. ""This is a really unbelievable fishmonger. I'm sure it is the widest selection of fish and seafood ..."" more. 2 . Whale Fish Direct Fisheries. 3 . Out Of The Blue."
Fragbox: Canada's Best Coral Frags and Saltwater Fish Store.,https://fragbox.ca/,"Fragbox is a saltwater coral and fish store in Toronto specializing in shipping corals, saltwater fish, marine invertebrates and aquarium hardware. We are retailer store and only carry the best. You can reach us at 416 265 8481. We are proud to be the best Canadian run online coral store and one of the best in Toronto."
Aqua Market,https://aquamarket.ca/,"We can find and provide many species of tropical freshwater and saltwater fish. Our team of professionals, breeders, and worldwide suppliers can find the particular fish species that you are looking to keep. Medications. We have experience when it comes to resolving issues with the health of your fish. We have a variety of disease treatments ..."
Are any of you fish store owners? Is it a tough business? I ... - Reddit,https://www.reddit.com/r/Aquariums/comments/51r6z0/are_any_of_you_fish_store_owners_is_it_a_tough/,Fish sell well with the right customers but the money is in your supplies for the most common pets. ... I work at a boutique/higher end saltwater/freshwater fish store and planted tanks are really the norm for freshwater now. ... and amazon has them at $300. I also retail them in my store for $300. This means I make roughly $30 when I sell a ...
J & S Fresh Fish - J & S Fresh Fish,https://jsfresh.fish/shop/,"J & S Fresh Fish aims to fulfil any special request for unusual fish, shellfish and fish products. To place an order you will first need to open an account by calling 02380 268 525."
10 Trustworthy Aquarium Stores in Singapore [2024] - Finest Services,https://finestservices.com.sg/aquarium-stores/,"The shop sells both freshwater and marine fish, as the name would imply. They feature a big assortment of aquarium necessities. For substantial installations, they also provide complete solutions. ... Toh Aquarium, which opened as a retail location in 2017, has also just entered the e-commerce market. Fish lovers Uncle Toh and his son Ian, who ..."
Frag Trade - Marine aquarium and coral store.,https://fragtrade.co.uk/,"A lifelong marine biologist and conservationist that has fallen in love with marine aquariums. Click here to view more about Micheals work and passions. FragTrade is a sustainable UK Grown, marine aquatic fragging company. We specialise in SPS, LPS, Zoas and Soft Corals, live foods & our very own products."
Home - Vision Aquatics,https://theoceanproject.uk/,"Vision Aquatics is a specialist Aquatic shop offering premium quality, healthy Koi, pond, Tropical and Marine fish and Coral. The best Aquatic shop in Dorset close to Bournemouth. All our items are available to purchase in store or online for speedy delivery. Our Aquatic store is based near the Dorset / Hampshire border, close to Ringwood ..."
My 5 Favorite Best Fish Stores In Ohio In 2021 - VivariumTips,https://vivariumtips.com/fish-stores-in-ohio,"Reef Systems Coral Farm - Fish Store In Ohio Details. Address: 8459 Peter Hoover Rd, New Albany, OH 43054. Phone Number: (614) 933-8779. Website: Reef Systems Coral Farm. From VivariumTips, To aquarium enthusiasts from Ohio, I hope that this fish store guide helped you find the location you're most compatible with."
Dallas North Aquarium - Texas' Largest Aquarium Specialty Store,https://dallasnorthaquarium.com/,"Our store location is a 14,000 square foot facility featuring four 215 gallon wall installations, large Coral ponds, 6,500 square feet of dry goods and aquariums, as well as 10,000 gallons of fresh and saltwater livestock. DNA has the largest inventory of aquarium products in Texas. Dallas North's friendly and knowledgeable staff has ..."
Lincolnshire's Marine and Tropical Fish Specialists - Aquatic Pet Shop,https://perrysaquaticscentrelincoln.com/,"Perry's Aquatic Centre is Lincolnshires premier destination store for Clean Marine, Totally Tropical & Cool Coldwater Fish & Accessories. We are the one stop shop for quality corals, inverts, plants, plankton, tanks, lighting, filters, feeds and our famous FREE Water Test Service! Wayne Perry - Owner of Perry's Aquatic Centre."
