title,href,body
Overview of the Licensing and Regulation of Pet Shops (U.K.),https://www.animallaw.info/article/overview-licensing-and-regulation-pet-shops-uk,"This document provides an overview of the UK's Pet Animals Act 1951. The Act establishes a regulatory regime for ""pet shops"" under which local authorities (district and borough councils) are responsible for inspecting and licensing premises. ... Section 3 makes it an offence to sell a pet ""to a person whom he has reasonable cause to believe to ..."
Selling animals as pets licence (England) - GOV.UK,https://www.gov.uk/guidance/selling-animals-as-pets-licence-england,Contact your local council to apply for a licence to sell animals as pets in England. You need to get a licence if your business sells animals: as pets. which will later be resold as pets. You ...
High street retail in the United Kingdom (UK) - Statista,https://www.statista.com/topics/4655/high-street-retail-in-the-united-kingdom-uk/,"Annual rental cost of prime retail rents in the UK 2023, by market . Annual rental cost of prime high street retail rents in the United Kingdom (UK) in 2nd quarter 2023, by city (in GBP per square ..."
"Retail Bulletin, Daily UK Retail News",https://www.theretailbulletin.com/,"Featuring the latest retail news UK. We offer daily updates and analysis on the industry covering fashion, food and drink, home and DIY, health and beauty and much more. ... The Morrisons supermarket chain has acquired 38 stores in the Channel Islands from its long-term partner Sandpiper. The purchase also includes six fuel forecourts ..."
Brittle Starfish | Finest Aquatics,https://www.finestaquatics.co.uk/brittle-starfish,"Marine Invertebrates. Anemones; CUC (Clean Up Crew) Tropical Fish. Plecostomus; Catfish; Cichlids; Misc. Corydoras; ... Finest Aquatics are an award-winning aquatic retail store in Widnes. We have an extensive online and physical store stocking a large range of Marine, Tropical and Pond products. ... sales@finestaquatics.co.uk. Visit Our Retail ..."
Coral Passion | Marine Livestock Specialist | Essex,https://coralpassion.co.uk/,"Coral Passion is a marine shop in Essex with some of the best quality marine fish , corals and invertebrates. We sell hard and soft coral colonies and frags, clams, and a selection of shrimps, snails, urchins and other 'clean up crew' to help keep your reef algae free. We also stock a selection of dry goods, like reef salts, flake foods ..."
Who's Gone Bust in Retail? The Centre For Retail Research,https://www.retailresearch.org/whos-gone-bust-retail.html,"Studio Retail sells clothing, homeware, electricals and gifts. Its sales in the last financial year were £579m and had 2.5m customers. ... Singapore and New Zealand). There are up to five stores in the UK, three shops-within-shops in stores like Fortnum & Mason and Selfridges and an online business which, in Europe, seems now to be switched ..."
Australian retailer Harvey Norman to open first ... - Retail Gazette,https://www.retailgazette.co.uk/blog/2024/01/harvey-norman-england/,"15th January 2024. Australian retail giant Harvey Norman is to open its first store in England as it ramps up its UK expansion. The home and electricals retailer, which already has two branches in ..."
"Top 10 Best electronic stores Near London, London - Yelp",https://www.yelp.com/search?find_desc=electronic+stores&find_loc=London,"Top 10 Best Electronic Stores in London, United Kingdom - May 2024 - Yelp - Maplin, Gigabyte Electronics, Sony Centre, Argos, PC World, Muji, CeX, Westfield - London, Baseo TCR - Buy And Sell Electronics Outlet, The Hi Fi Surplus Store"
What Are Retail Stores? | Business.org,https://www.business.org/finance/inventory-management/what-is-a-retail-store/,"Retail is the sale of products directly to the consumer—the person who is actually going to use the item. Retailers face fundamentally different challenges compared to wholesalers (businesses that sell to other businesses, which then sell to the consumer). Unlike wholesalers, retailers have to worry about marketing their products. If an item ..."
The top 20 retail companies and stores in the UK - Consultancy,https://www.consultancy.uk/news/23822/the-top-20-retail-companies-and-stores-in-the-uk,"Retailers who can offer customers service beyond mere functionality have a better chance of weathering the UK's poor retail climate, ... The top 20 retail companies and stores in the UK. 21 February 2020 Consultancy.uk 4 min. read. ... Department store Founded: 1864. 14. Argos Retail segment: Catalogue Retail Founded: 1972. 15. B&M"
"THE BEST 10 Pet Stores in MANCHESTER, UNITED KINGDOM - Yelp","https://www.yelp.com/search?cflt=petstore&find_loc=Manchester,+UK","See more reviews for this business. Best Pet Stores in Manchester, United Kingdom - Manchester Pets & Aquatics, Planet Pet, Viper and Vine, Pet Stop, Urban Jungle, GayLyfe Pets & Aquatics, Petzone, Salfordpets, Friends For Life Pet Store, Pets at Home."
Store locator - Bose,https://www.bose.co.uk/en_gb/store_locator.html,"Store locator. TO OUR CUSTOMERS. To support you, our website can process any purchase, and you can get 24-hour service for returns, exchanges or repairs by visiting our Support page. Get your geolocation."
UK Retail Stats & Facts | Retail Economics,https://www.retaileconomics.co.uk/library-retail-stats-and-facts,"306,340. 8. Amount retail generates of total GDP (GVA) 6%. 9. Online retail sales growth in 2023. 5.1%. 10. Average weekly earnings in the retail sector in 2023."
"Model Aircraft Shop - Aviation Retail Direct, UK",https://www.aviationretaildirect.com/,ARDBA52 | ARD Models 1:200 | HS.121 Trident 1E British Airways Negus scheme G-ASWU (with stand) ARD Models. £99.95 Inc. Tax. £83.29 Ex. Tax.
Our Stores - thorntons.com,https://www.thorntons.com/uk/en/our-stores,"01773 743 932. Paperkisses & Thorntons. 65 Nottingham Road, Eastwood, Nottinghamshire, NG16 3AL. 01773 716408. Paperkisses & Thornton'S. Unit 12 St Mary's Place Shopping Centre, Market Harborough, Leicestershire, LE16 7DR. 01858 439977."
"Reptiles For Sale | Jabberwock Reptiles | Stoneham, MA",https://www.jabberwockreptiles.com/,"We strive to offer an informed & responsive service to our customers. These animals are fascinating and intriguing, and we love to share our passion! Learn More. We're Open. Opening Hours today: 12:00 pm - 7:00 pm. 781-729-0135. J abberwockReptiles@gmail.com. 157 Main Street, Stoneham, MA 02180."
Overview of the retail sector in the UK | Prospects.ac.uk,https://www.prospects.ac.uk/jobs-and-work-experience/job-sectors/retail/overview-of-the-retail-sector-in-the-uk,"According to Statista approximately 3.5million people work in the retail sector in the UK and information from a House of Commons Library research briefing paper tells us that the economic output of the retail industry was £112.9billion in 2023, accounting for 4.9% of the UKs total output. In 2023 retail sales in Great Britain were worth £ ..."
Retail trade in the UK - statistics & facts | Statista,https://www.statista.com/topics/8671/retail-trade-in-the-uk/,"Percentage growth in like-for-like sales in high street stores in the United Kingdom (UK) from January 2017 to October 2023, by sector ... Premium Statistic Non-store retail sales in Great Britain ..."
Retail Law: what you need to know as a shop owner,https://gosuperscript.com/news-and-resources/retail-law-your-rights-as-a-retailer/,"A small shop is considered one that measures up to and including 280 square metres. Small shops in England and Wales can open any day or hour. If your shop is larger than this, you cannot be excluded from the restrictions by closing part of your shop to fit the 280 square metres. Large shops that are over 280 square metres must close on ..."
Sea Hare | Finest Aquatics,https://www.finestaquatics.co.uk/sea-hare,"We dispatch livestock weekly with DX Livestock Insured Service which are delivered the next day generally between 9am - 1pm. Our dispatch days are Tuesdays, Wednesdays and Thursdays. Once we have received your order, we will contact you to arrange which day will be best for you. Please Note: In the rare case of DOA (dead on arrival) or livestock arriving in an unhealthy condition, we need to ..."
Selling fish - OATA - The Ornamental Aquatic Trade Association,https://ornamentalfish.org/what-we-do/set-standards/selling-fish/,"Pet shops. All commercial businesses that sell vertebrate animals, such as fish, need to be inspected and licenced by their local authority. In England, Scotland and Wales these are now regulated by Animal Activities Licence regulations and require pet shops and other businesses which sell animals to meet mandatory standards."
"Arachnid Shop - Invertebrates, Reptiles, Enclosures & More!",https://arachnidshop.com/,"A little about us. With over 20+ years of experience in breeding and handling of reptiles and invertebrates. We decided to turn our passion into a business. In 2020 we opened up what is now known as the ""Arachnid Shop"". We wanted to share our love of animals with others and bring knowledge of these amazing creatures to anyone who wanted to know ..."
Types of Shops and Stores in Britain,https://projectbritain.com/shoptypes.html,"Off-Licence shops sell alcholic beverages. Chain Store. Chain stores are a number of retail stores under the same ownership selling the same goods. Each shop in a retail chain will have the same name. e.g. WHSmith, Marks and Spencers, Sainsburys. Most Popular Shops for fashion clothes. Clothes Shops. For Boys. Burton - The most popular mens ..."
Invertebrates - New England Reptile - NERD,https://newenglandreptilestore.com/collections/invertabrates,"We sell the most diverse collection of Ball Pythons, Morphs, Reticulated Pythons, Water Monitors and rare unusual reptiles in captivity. ... $500 and Under Invertebrates. millipede $225.00 ... New England Reptile Distributors 149 Plaistow Road Plaistow, NH 03865. Call us: (603) 382-2772 Email: newenglandreptile@gmail.com. Shop NERD. SNAKES"
"Wholesale Reptiles, Amphibians, Inverts & More - UGR Wholesale",https://ugrwholesale.com/,your premier source for wholesale reptiles & exotics - call us at 954-428-8005
Invertebrate licences - GOV.UK,https://www.gov.uk/government/collections/invertebrate-licences,Contents. Licences to possess or sell invertebrates. European protected invertebrates mitigation licences. Licences to survey or research protected invertebrates. Licences for little whirlpool ...
"Paprika Store - Hungarian grocery store chain, online store and ...",https://www.paprikastore.co.uk/,Our friendly and helpful colleagues are looking forward to your visit. We try to keep our prices as low as possible. We are proud of the fact that we offer the Hungarian food at the best price in the UK and Ireland. In our stores and in our webshop you can find almost every Hungarian product and household item you can only remember.
Pom Pom Crab | Finest Aquatics,https://www.finestaquatics.co.uk/pom-pom-crab,"Pom Pom Crab. Be the first to review this product. £20.00. 1 In Stock Available For Immediate Dispatch. Only 1 left. SKU. PomPomCrab. You will earn 20 Reward Points by purchasing this item. Applies only to registered customers, may vary when logged in."
Cascade Koi & Aquatics| Cascade Water Gardens,https://www.cascadekoi.co.uk/cascade-koi--aquatics-retail-shop-179-c.asp,Thursday 9.30am Till 5pm. Friday 9.30am Till 5pm. Saturday 9.30am Till 5pm. Sunday 10am Till 4pm. We are OPEN for all Internet Orders at .. www.cascadekoi.co.uk. 0161 764 3760...or enquiries@cascadekoi.com. Take A Trip Around The Shop With Our Great New Video!! Cascade Water Gardens - Koi and Tropical Fish.
"PDF Invertebrate biodiversity is improving in England's rivers, long-term ...",https://phys.org/news/2023-10-invertebrate-biodiversity-england-rivers-long-term.pdf,"The average number of families of freshwater invertebrates found at each site increased from 15 to 25 between 1989 and 2018. Overall, this is an average 66% increase in the number of invertebrate ..."
Australian Invertebrates | Invertebrate Shop,https://australianinvertebrates.com/,"Welcome to Australian Invertebrates, your premier online store for purchasing fascinating and unique invertebrates from all around Australia! Our easy-to-use e-commerce platform provides you with a hassle-free shopping experience, allowing you to browse and purchase our extensive collection of invertebrates from the comfort of your own home ..."
Experience Dell at a retailer near you | Dell UK,https://www.dell.com/en-uk/lp/reseller_store_locator,"Find a retail store near you to buy award winning Dell laptops & desktop PCs - XPS, Inspiron & Alienware. Find your store now. ... PayPal Credit is a trading name of PayPal UK Ltd, Whittaker House, Whittaker Avenue, Richmond-Upon-Thames, Surrey, TW9 1EH, United Kingdom. PayPal Credit acceptance is subject to status, terms and conditions apply."
Mexican turbo snail | Finest Aquatics,https://www.finestaquatics.co.uk/mexican-turbo-snail,"Mexican turbo snail. Be the first to review this product. £6.50. 3 In Stock Available For Immediate Dispatch. SKU. mexicanturbosnail. You will earn 7 Reward Points by purchasing this item. Applies only to registered customers, may vary when logged in. QTY."
"Reptiles, Invertebrates - Standout Serpents",https://standoutserpents.com/,"Standout Serpents is an online exotic reptile and invertebrate store. Buy high quality snakes, lizards, tarantulas and more in prime condition! ... Come see us at our retail store for amazing deals on top quality exotics and supplies. At the store we are not just reptiles but all exotics! Get directions."
The Top 10 UK Animal & Pet Trade Shows | Exhibition Calendar,https://www.displaywizard.co.uk/the-top-10-uk-animal-pet-trade-shows/,"Bradford Premier Small Animal Show. Held at Doncaster Racecourse, the `Bradford` Premier Small Animal Show is the longest running and biggest small animal exhibition show held in the UK, now entering its 97th year. Around 5,000 consumers visit the show each year, largely made up of families and pet owners. The show caters for a wide range of ..."
Here's the full list of high street stores closing in 2024 - Time Out,https://www.timeout.com/uk/news/heres-the-full-list-of-high-street-stores-closing-in-2024-010224,Argos plans to close 100 UK sites in 2023 and 2024 as it focuses on expanding its presence in supermarkets instead of the high street. Over the last 12 months it has closed 45 shops but opened up ...
Two water groups blamed for 40% of England's sewage spills in 2022,https://www.ft.com/content/f07442f4-0a0f-4268-84b6-6c8407e7b893,"United Utilities and Yorkshire Water were responsible for 124,000 sewage spills by water companies in England last year, more than 40 per cent of the number recorded, according to the country's ..."
Invertebrates For Sale - Imperial Reptiles,https://imperialreptiles.com/collections/invertebrates-for-sale,Mexican Red Rump Tarantula (Tliltocatl (Brachypelma) vagans) $24.99 from $22.49 Save $2.50. Sold Out. Amazon Blue Bloom Tarantula (Xenesthis intermedia) from $149.99. Sold Out. Mexican Painted Red-leg Tarantula (Brachypelma emilia) $119.99 $107.99 Save $12.00.
Fossils For Sale | Fossils-uk.com | Online fossil shop,https://www.fossils-uk.com/,"Welcome to Fossils-uk.com - Britain's premier online fossil shop and biggest range of fossils for sale. ... Once finishing his degrees then Byron opened his retail store called ""Natural Wonders"" in the picturesque seaside town of Whitby, North Yorkshire. An area rich in fossil finds. We have therefore been selling fossils online and in the ..."
Find a Loake Store | English Men's Shoes & Boots | Loake Shoemakers,https://www.loake.com/shop/,"Our UK stores are the perfect place to display Loake's craftsmanship, and to showcase the brand that is now available from approximately 1,000 retail shops around the UK. Many of the shoes available to buy in store are handcrafted in our factory in Kettering, Northamptonshire, where we've been making shoes since 1894. Due to space ..."
Idiosyncratic trends of woodland invertebrate biodiversity in Britain ...,https://resjournals.onlinelibrary.wiley.com/doi/full/10.1111/icad.12685,"Here, we assessed the trends of woodland invertebrate species (21 taxon groups of insects, spiders, centipedes, and molluscs) in Britain over a 45-year period (1970-2015). We focused on invertebrates since their trends are especially poorly documented, but many are found in woodland habitats performing key ecosystem functions."
Dino Fossils UK: Huge Selection of Fossils For Sale.,https://www.dinofossils.co.uk/,"Thousands of fossils for sale at Dino Fossils UK online rock & fossil store, Serving private fossil collectors, Museums & Universities worldwide since 2012. account; basket. Basket Items. Your basket is currently empty. Sub Total. ... Shop our selection of the most rare, interesting and high quality fossils from all around the world."
"DJI Retail - Licensed Store for DJI Drones, Gimbals and Accessories ...",https://dji-retail.co.uk/,"Shop with confidence with DJI Retail. DJI is the world's leading producer of camera drones and stabilisers. Check out our Mini, Mavic, and Air drones, Ronin and Osmo gimbals, and more! ... 2020, along with updates announced by the UK CAA/DfT in November 2022 regarding the Transitional Period extension and the UK's position on EU drone markings."
Reptiles/Invertebrates Pet Shop | Shauna's Pet Shop | Online Pet Store ...,https://www.shaunaspetshop.ie/reptiles,"Happy new owner of two Gerbils thanks to them! Would recommend to anyone looking for pets or pet supplies or even just pet information in general, Amazing! Alex Wong. Shauna's Pet Shop is Ireland's No1 Reptile & Invertebrate Pet Shop. Our online reptile pet shop sells reptile food, reptile cages, reptile habitats & reptile accessories."
The top ten fabric shops in the UK | Fashion | The Guardian,https://www.theguardian.com/fashion/fashion-blog/2013/jun/11/top-ten-fabric-shops-uk,"The bricks and mortar look stunning and the fabric selection is just gorgeous. If you're in the Black Country and looking for inspiration, you could do worse than pay Lauren a visit. Guthrie ..."
Mexican turbo snail | Finest Aquatics,https://www.finestaquatics.co.uk/livestock/marine-invertebrates/mexican-turbo-snail,"Mexican turbo snail. Be the first to review this product. £6.50. 3 In Stock Available For Immediate Dispatch. SKU. mexicanturbosnail. You will earn 7 Reward Points by purchasing this item. Applies only to registered customers, may vary when logged in. QTY."
Store Locator | FitFlop UK,https://www.fitflop.com/uk/en/retailer-locator,UK 3 UK 4 and 4.5 UK 5 and 5.5 UK 6 and 6.5 UK 7 UK 8 ... SIGN UP TO NEWSLETTER & GET 15% OFF* STUDENT & KEY WORKER DISCOUNTS STORE LOCATOR. STORE NAME ADDRESS CITY COUNTRY POSTAL CODE PHONE NUMBER EMAIL ADDRESS; ... 4 Feet Retail Ltd T|A 4 Feet: London : Allen Phillips Ltd: St. Neots : C J Townrow and Sons Ltd - AIS:
Terrestrial Invertebrates - Buglife,https://www.buglife.org.uk/bugs/types-of-invertebrates-by-habitat/terrestrial-invertebrates/,"Terrestrial Invertebrates. Terrestrial invertebrates are those that complete their lifecycle on land. There are numerous examples of terrestrial living invertebrates in the UK- spiders, snails, bees, ants, butterflies, some flatworms and woodlice, beetles and many more! Depending on their requirements to complete their life cycles, terrestrial ..."
Visit Us In Store - DJI Official Retail UK,https://dji-retail.co.uk/pages/visit-us-in-store,"Discover a world where precision meets innovation at the DJI | Hasselblad Experience Store Birmingham, the UK's sole DJI authorised Official Flagship Retail Store. Established in 2023, we are proud to offer an exclusive haven for technology and photography enthusiasts alike. As the only venue in the UK featuring a complete range of live demo ..."
Aquator - Fish-reptiles-inverts-birds,https://www.aquator.co.uk/,"We are an independent, family run exotic pet shop located in Torquay, Devon. We stock and specialise in a wide range of tropical and marine fish, reptiles and invertebrates, we also offer a small selection of birds. Available in store, and to order for delivery straight to your home, we have a large choice of aquariums."
TOP 40 Products to Sell in the UK Online in 2024 | BusinessNES,https://businessnes.com/best-products-to-sell-in-the-uk/,"5. Organic tea & coffee. For example detox tea, organic herbal tea, organic matcha, organic ground coffee and accessories for coffee and tea making. 6. New healthcare items. Like kneecare products, wireless nurse alert, new advanced blood pressure monitors and other devices of this category in high quality. 7."
Retail Shop Investors in England - Sell or Finance your Retail Shop in ...,https://www.smergers.com/retail-shop-investors-in-england/c84s1502i/,"Retail Shop Investors in England. Sell or finance your Retail Shop, Shop, Commercial Shop, Turnkey Business, Apparel Store, Computer Shop, Food Shop, Auto Dealer, Home Furnishing Shop or a Specialty Retailer."
"Best UK wine retailers: The local, national and online retailers of the ...",https://www.decanter.com/decanter-retailer-awards/best-uk-wine-retailers-local-national-online-retailers-year-429603/,"The original city-centre shop and bar has been upgraded, a new store opened and customer engagement improved, including successful events. Loki is now a leading British wine retailer. The WoodWinters list remains strong and the three stores are laudably community minded. Local Wine Shop of the Year: The Whalley Wine Shop Runner-up: Lockett Bros"
Invertebrates - Livestock - Blue Lizard Reptiles - Reptile Shop,https://www.bluelizardreptiles.co.uk/livestock/invertebrates,Livestock - Invertebrates Indian Stick Insect (Carausius morosus) CB The stick insect everybody used to keep as a child! RRP - £3.99 Our Price - £3.49 (inc.VAT) ... England & Wales £50.00 Southern Scotland £55.00 Northern Scotland (not offshore) £65.00 View Delivery FAQ.
How technology is disrupting the UK retail industry | McKinsey,https://www.mckinsey.com/industries/retail/our-insights/rebooting-retail-how-technology-will-shape-the-future-of-retail,"For workers, technology will bring big changes. By 2030, we see it affecting a third of all tasks in UK retail (Exhibit 1). Roles will be redefined to encompass larger, more complex and varied work than today's narrower, more siloed retail jobs, and will involve interacting with new technologies. Companies will need to develop or recruit the ..."
Liberty | Designer Department Store Selling Luxury Brands,https://www.libertylondon.com/,"Discover the full range of luxury fabrics, designer clothing, stylish homewares and sumptuous beauty products from Liberty, London's favourite heritage department store."
"Shops For Sale in the UK, 4,916 Available To Buy Now",https://uk.businessesforsale.com/uk/search/retail-businesses-for-sale,"Location: Worcestershire, Worcestershire. Description: Optic-Kleer is the UK's leading car windscreen repair franchise. Established for over 30 years, this low investment, low-overhead franchise opportunity has a high ROI and serious scope for growth. More details ». Financials: Franchise Fee: £20,000 + VAT."
Retail technology in the United Kingdom (UK) - Statista,https://www.statista.com/topics/5425/retail-technology-in-the-uk/,"E-commerce revenue in the United Kingdom (UK) from 2015 to 2021 (in billion British pounds) E-commerce sales in the United Kingdom (UK) 2014-2019, by technology. E-commerce sales in the United ..."
Find a DJI store that best suits you - Where to Buy - DJI,https://www.dji.com/uk/where-to-buy/retail-stores,"Shop with DJI Store. Get 1% DJI Credit Rewards, Free Shipping on Orders Over USD $149, 14-Day Returns, and other exclusive official offers. Whether you purchase online or offline, we offer various authorized channels for you to buy a full set of DJI innovative collections at your convenience."
Welcome to the Farm Retail Association,https://farmretail.co.uk/,"Championing the best farm retailers from across the UK. The Farm Retail Association (FRA) champions the best farm shops and farmers' markets from across the UK. We are proud to support and inspire the people and businesses who grow and sell Great British food. Whatever area of farm retail you are from, we are here to help you and your business."
Cftn - Largest Uk Spider Shop - Creatures From the North,https://creaturesfromthenorth.eu/,"Communal:NO. Experience level:BEGINNER. Nhandu chromatus - Terrestrial - Burrower Brazil, Paraguay - 24-28°c - Wet season Dec-March. Adult body length 6-7cm. CFTN Mystery Box Beginner YOUNG FEMALES ONLY LIMITED EDITION 100% EXTRA. 75.00 £56.25 £. CFTN Mystery Box Beginner YOUNG FEMALES ONLY LIMITED EDITION 100% EXTRA."
Retail market worldwide - Statistics & Facts | Statista,https://www.statista.com/topics/5922/retail-market-worldwide/,Revenue of retail enterprises above designated size in China 2012-2022. Retail market size in Japan 2013-2022. Retail market value in India 2018-2032. Latin America: retail sales value 2017-2022 ...
"DJI Store - Official Store for DJI Drones, Gimbals and Accessories ...",https://store.dji.com/uk,"New · Lightweight Commercial Stabilizer. DJI RS 4. From £469. Lightweight Travel Stabilizer. DJI RS 3 Mini. From £259. Cinema Camera. DJI Ronin 4D-8K. From £5,659."
Retail centers by store numbers UK | Statista,https://www.statista.com/statistics/1024837/leading-uk-retail-centers-by-store-numbers-in-the-united-kingdom/,"As of 2019, there were 6,830 stores operating in the London West End retail center. Manchester City Center and Glasgow City Center came in second and third place, with 1,590 and 1,559 stores ..."
Find a Microsoft Store Near Me - Microsoft Store,https://www.microsoft.com/en-gb/store/locations,"253-259 Regent Street. London, England W1B 2ER. Find us on the southwest corner of Oxford Circus. 02076600308. Opening hours:"
