title,href,body
The UK's Best Farm Shops To Visit In 2024 - Country and Town House,https://www.countryandtownhouse.com/food-and-drink/farm-shops-uk/,"The shop is known for selling top quality meat, with the option to make your own hamper from the meat and pantry section. You'll also find a dairy here, selling fresh cheese, milk and butter from the local farm in Somerset. Charlton Musgrove, Wincanton BA9 8HD; kimbersfarmshop.co.uk. Gloucestershire: Daylesford Farm Shop, Kingham"
Types of Shops and Stores in Britain,http://www.projectbritain.com/shoptypes.html,"With more than 300 shops and parking for 13,000 cars, it attracts around 30 million visitors each year. Corner Shop A corner shop is a small shop near houses. It has a limited variety of food but often has long opening hours. Supermarkets. Supermarkets are large self-service shops selling mainly food. Large supermarkets also sell household goods."
Leading 10 retailers in the UK 2023 | Statista,https://www.statista.com/statistics/462863/leading-ten-retailers-by-sales-uk/,"Nov 21, 2023. The United Kingdom's leading retailers were supermarket chains, with Tesco ranking at the very top based on its annual sales of approximately 39.7 billion British pounds for 2022/ ..."
The UK's 30 best fashion boutiques | Fashion | The Guardian,https://www.theguardian.com/global/2018/may/20/the-uks-30-best-fashion-boutiques,"A unique offering, Old Town calls itself a micro-clothing company and produces and sells early-20th-century-inspired workwear in a contemporary style from its shop and workshop in Holt."
Beauty Products Home Page | Skincare | Fresh,https://www.fresh.com/uk/home,"Safety backed by science. At fresh, we care as much about what we put into our products as what we leave out. We adhere to stringent international regulations and ban hundreds of ingredients from our formulas. Our experts test every ingredient an average of 3 times to ensure it's safe on skin. We spend 2+ years validating each product's ..."
Buyers and sellers of first-sale fish - GOV.UK,https://www.gov.uk/government/publications/buyers-and-sellers-of-first-sale-fish-and-submission-of-sales-notes/buyers-and-sellers-of-first-sale-fish,4. Register as a buyer or seller of fish. You can register as a buyer and/or seller of first-sale fish for free by completing the form RBS1. You will need to provide details of: you or your ...
Where to Sell Shrimp: A Complete Guide - Shrimp Tank Talk,https://shrimptanktalk.com/where-to-sell-shrimp/,"You're more likely to find ghost shrimp at your local pet store, and they're pretty cheap. If you keep higher grades of cherry shrimp, like Bloody Mary shrimp or Kanoko shrimp, you can sell them for $8 to $10 per shrimp. The condition of your shrimp and how well you take care of them may or may not be relevant, depending on your target ..."
Cut flower trade: How the global industry is transforming - BBC,https://www.bbc.com/future/bespoke/made-on-earth/the-new-roots-of-the-flower-trade,"The scale of the global market for cut flowers is large, and increasing. In the UK alone, the market for cut flowers and ornamental plants was worth £1.3 billion in 2018, according to government ..."
32 Best Online Fish Stores In 2024: (Freshwater And Marine),https://simplyaquarium.com/best-online-fish-store/,"Visit Saltwaterfish.com. Saltwaterfish.com is one of the leading online marine retailers in the U.S. They have over 4,600 Trustpilot reviews and have been rated one of the best online pet supply stores in a 2021 Newsweek survey. Saltwaterfish.com offers a huge range of marine fish, invertebrates, live rock, and corals."
Price's Candles | prices-candles.co.uk,https://www.prices-candles.co.uk/,"Price's Candles® Free UK Delivery! Established In 1830, Multiple Payment Options Available. ... Fresh Air. Heritage. Petali. Luxury. Tealights & Nightlights. Altar & Pillar. Dinner Candles. Citronella/Garden. Unfragranced. Accessories. Shop by; Candles; Reed Diffusers; Offers; Home 2023-11-06T10:15:23+00:00. ... Collections Signature ..."
The UK's Widest Range of Trees | Frank P Matthews,https://www.frankpmatthews.com/,"Frank P Matthews is one of the largest tree growing nurseries in the UK. We grow over one million container grown and bare root, fruit and ornamental trees every year for supply into garden centres, mail order companies, commercial growers and our very own Tree Shop. Every year we introduce many new exciting varieties to extend our range of ..."
THE 10 BEST York Gift & Speciality Shops (Updated 2024) - Tripadvisor,https://www.tripadvisor.co.uk/Attractions-g186346-Activities-c26-t144-York_North_Yorkshire_England.html,"234. Speciality & Gift Shops. By sarahfR9048AC. Amazing shop, staff are so warm and friendly and willing to chat to you whilst waiting in the queue. 8. The Yorkshire Soap Company. 113. Speciality & Gift Shops. By HevsHolidays."
Supermarket prices: which is the cheapest supermarket in 2024? - Which?,https://www.which.co.uk/reviews/supermarkets/article/supermarket-price-comparison-aPpYp9j1MFin,"April 2024. Aldi was the cheapest supermarket in April, charging £112.90 on average for our shopping list of 67 popular groceries. Lidl was close behind, at £2.33 more (£115.23). Waitrose was the most expensive supermarket at £144.13 - that's 28% more than Aldi. Supermarket."
Store Locator | Virgin Media,https://store.virginmedia.com/sim-store-locator.html,"We've got an incredible range of phones and phone plans fit for every budget, so while you're in why not have a peruse. We do broadband. and TV too…. We're pretty good at it as well! With broadband, TV and phone bundles crafted for all tastes, our in-store team can help find the perfect fit for you. Find your nearest store."
Retailing Exam 1 | Quizlet,https://quizlet.com/test/retailing-exam-1-144668802,"Fresh n Fragrant is a chain of flower shops offering a variety of flowers and ornamental plants. It recently opened a distribution center to supply ornamental plants and cut flowers to all its stores within a 300-mile radius. From the given scenario, it can be seen that Fresh n Fragrant is practicing ___."
Butters Shop,https://butters.co.uk/,"Whether you're an avid gardener or a beginner, Butters Factory Shop is the ideal place for you. Our garden shop carries a wide range of quality plants and products together with an extensive selection of garden furniture, houseplants and gifts Our handy car park facilities make us convenient for you to visit from Spalding or throughout Lincolnshire."
The 8 Best Places to Buy Real Christmas Trees Online in 2023,https://www.businessinsider.com/guides/home/where-to-buy-real-christmas-trees-online?op=1,"Shop all Christmas trees at Hammacher Schlemmer. For fresh-cut trees, Hammacher Schlemmer is a great choice. You can get a Fraser fir between 4.5 and 8.5 feet for $129.95 to $199.95, plus a truck fee."
Retail revolution and the village shop (1660-1860),https://ehs.org.uk/retail-revolution-and-the-village-shop-1660-1860/,"Home > Retail revolution and the village shop (1660-1860) By Jon Stobart (Manchester Metropolitan University) Today, village shops are often seen as central to village life and their closure is greeted with alarm because, like pubs, they act as a litmus for the health and vitality of our rural communities. Yet we know little about the long ..."
Pets in the UK 2022 | Statista,https://www.statista.com/study/78233/pets-in-the-uk/,"Pet supply shops . ... / Fresh food (meat, vegetables, fruit) ... Premium Statistic Pets and pet food retail sales in specialized stores in Norway 2011-2022"
Our In-Person UK Stores | Shopping | Fresh UK,https://www.fresh.com/uk/ourstores.html,"Store Details. 92 Marylebone High Street, London, W1U 4RD. Opening Times: Mon - Wed 10am - 6pm. Thurs - Sat 10am - 7pm. Sunday 11am - 5pm. Contact: +44 20 7486 4100. Harrods."
ShrimpLand - Shrimp UK - Freshwater Aquarium Shrimp,https://www.shrimpland.uk/,SMN Shrimp G-6 Planaria Removal. £19.00. Quick View. NO MORE PLANARIA! SL-Aqua Z1 Aquarium Bio Protector. £15.00. Quick View.
"Horticultural business, production and food - Grow Careers",https://www.horticulture.org.uk/grow-careers/business-production-food/,"Business, production and food in the UK horticulture industry is worth over £5 billion each year. Businesses growing fruit and veg employ over 50,000 people, while ornamental plant nurseries and garden centres produce and sell millions of plants, generating thousands more jobs. And it's not just the green fingered among us who are valued ..."
23 Best Farm Shops In The UK For Farm-To-Table Food - pebble magazine,https://pebblemag.com/farm-shops-uk/,"Location: Toulston. 3. Lynne's Organic Farm, East Sussex. Everything sold in the farm shop at Lynne's Organic Farm is produced on-site, making it one of the best UK farm shops for sustainable produce. The smallholding of just 35 acres is based in the High Weald Area of Outstanding Natural Beauty near Eridge."
Australian retailer Harvey Norman to open first ... - Retail Gazette,https://www.retailgazette.co.uk/blog/2024/01/harvey-norman-england/,"15th January 2024. Australian retail giant Harvey Norman is to open its first store in England as it ramps up its UK expansion. The home and electricals retailer, which already has two branches in ..."
Freshwater Aquarium Fish for Sale Online | Arizona Aquatic Gardens,https://azgardens.com/product-category/freshwater-tropical-fish/,"Scroll to bottom of any page to read our weekly Shipping Schedule. Orders placed by Sunday night/early Monday generally ship the same week by Wednesday! THANK YOU FOR YOUR BUSINESS! AZGardens.com has a variety of freshwater tropical fish for sale online including catfishes, cichlids, schooling fish, algae eaters, and more. Click here to shop!"
Sunbeam Aquarium | Asia Largest Ornamental Fish Exporter,https://sunbeamaquarium.com/,"Sunbeam Aquarium wholesale facility at Chencharu consists of 2 buildings sitting on 10,000 square feet of land, we are the largest indoor ornamental wholesale quarantine and export fish facility in Singapore. From our central location in Asia, we supply tropical freshwater fish, crustaceans, molluscs, soft corals, marine fish and aquatic plants ..."
Top 10 Online Shopping Sites in UK (2022),https://www.myukmailbox.com/blog/the-top-50-online-shops-in-the-uk/,"Okay, so it doesn't have a physical store, but it's the perfect place to start your UK online shopping experience. Visit Amazon UK. 2. John Lewis. John Lewis offers a wide range of tech, homeware, beauty, lighting, fashion and garden products. And there's a wide selection of gifts and toys too."
The 100 best shops in London - Time Out,https://www.timeout.com/london/shopping/the-100-best-shops-in-london,"Amazing London shops. 1. Daunt Books Marylebone. Shopping. Bookshops. Marylebone. Best for: a vast array of page-turners. One of London's most charming bookshops, Daunt's Marylebone flagship ..."
Kapruka.com | Sri Lanka Online Shopping Site | Send Gifts to Sri Lanka,https://www.kapruka.com/shop/wholesale-flowers-in-sri-lanka-an-undying-bloom,"Gerberas Orange, Comes in Packs of 100 - Rs. 40 each. Gerberas White, Comes in Packs of 100 - Rs. 40 each. Gerberas Red, Comes in Packs of 100 - Rs. 40 each. Sandriana, Comes in Packs of 50s. 65 to Rs. 70 each. Orchids Sonia, Comes in Packs of 100 - Rs. 10 each. Orchid Dendrobium, Comes in Packs of 100 - Rs. 15 each."
Where can I find a SKECHERS Retail Store or Outlet?,https://skechersuk.freshdesk.com/support/solutions/articles/19000010372-where-can-i-find-a-skechers-retail-store-or-outlet-,"Keeping Shoes Fresh: ... To return an item(s) purchased at a SKECHERS Retail Store, bring the unworn item(s) back to the store of purchase with the original receipt and box. ... Ireland for resale at wholesale to department stores and specialty retailers and for resale at retail through Skechers UK's own retail locations."
"John Lewis & Partners | Department Store | Home, Fashion, Tech & More",https://www.johnlewis.com/,"Shop latest trends and launches across Home, Fashion & Tech at John Lewis & Partners. ... Fresh Air. Pre-order now. iPad Pro. Thinpossible. Pre-order now. Save £50 on iPhone 15 Pro & Pro Max. ... UK 18+. John Lewis PLC is a broker. Creation is the lender. T&Cs apply. Find out more Payment plans at John Lewis. Book. Wear. Return."
Who's Gone Bust in Retail? The Centre For Retail Research,https://www.retailresearch.org/whos-gone-bust-retail.html,"It was later (April) acquired by another online company, TheRugSeller.co.uk which relaunched the Shabby Store as Shabby.co.uk selling homewares as well as furniture with the same ethos as the original Shabby Store. Studio Retail, an Accrington-based online retailer 29% owned by Mike Ashley's Fraser Group, went into administration in mid ..."
Ornamental Fish Imports - 500+ wholesale fresh and salt water fish,http://www.ornamentalfishimports.com/,"About Us. Ornamental Fish Imports Inc. is an importer of a variety of exotic fish from multiple countries in South America, including Colombia, Peru, Brazil, Ecuador, and Guyana. Ornamental Fish also imports from Nigeria, and offers native American species as well. Read More."
"Outside England? Sell bulb, circulating blooms - Dan Word",https://www.danword.com/crossword/Outside_England_Sell_bulb_circulating_blooms,"Today's crossword puzzle clue is a cryptic one: Outside England? Sell bulb, circulating blooms. We will try to find the right answer to this particular crossword clue. Here are the possible solutions for ""Outside England? Sell bulb, circulating blooms"" clue. It was last seen in British cryptic crossword. We have 1 possible answer in our database."
15 Aquarium Shops In Singapore For One-Of-Kind Fish & Aquascaping,https://thesmartlocal.com/read/aquarium-shops-singapore/,"- Specialty fish stores - 1. The Labyrinth - Exotic show ornamental fighting fish. Image credit: The Labyrinth Think of fighting fish and your mind might automatically jump to dull-coloured fish geared for battle, but that couldn't be further from reality at The Labyrinth Singapore.The boutique shop specialises in ultra rare ornamental fish that are top of the line in terms of form and ..."
Tropical fish wholesale and Marine fish wholesale - Segrest Farms,http://www.segrestfarms.com/,"En Español. Segrest Farms is the industry leader for wholesale ornamental fish, supplying pet stores, public aquariums, and research institutions since 1961. Premium quality and unmatched variety of freshwater tropical & coldwater fish, saltwater specimens, aquatic plants, and reptiles, supported by first class customer service and ..."
Our Stores,https://www.thorntons.com/uk/en/our-stores,"01773 743 932. Paperkisses & Thorntons. 65 Nottingham Road, Eastwood, Nottinghamshire, NG16 3AL. 01773 716408. Paperkisses & Thornton'S. Unit 12 St Mary's Place Shopping Centre, Market Harborough, Leicestershire, LE16 7DR. 01858 439977."
24 Best Farm Shops In Cornwall - Updated 2022 - CornishHampers.com,https://www.cornishhampers.com/blogs/news/52172805-24-best-farm-shops-in-cornwall-for-fine-cornish-food,"Slaughterbridge, Camelford, PL32 9TT. Set in a garden with pretty views of the Cornish countryside, Hilltop Farm shop stocks carefully chosen, locally sourced Cornish produce. They also have a selection of arts and crafts such as glassware, cushions and cards. Dutson, Launceston, Cornwall PL15 9SP."
Best Grasses and Foliage Plants for Gardeners in New England,https://www.gardenia.net/guide/best-ornamental-grasses-and-foliage-plants-for-gardeners-in-new-england,"Stachys byzantina, commonly known as Lamb's Ear, is a low-growing perennial with distinctive silver-gray, velvety foliage. It reaches 6-8 inches in height (15-20 cm), producing small, pink to purple flowers in early summer. Drought-tolerant and deer-resistant, it's perfect for ground cover and borders. Add to Collection."
Making money from your vegetable patch - The Guardian,https://www.theguardian.com/money/2013/jul/26/making-money-allotment-gardeners,"Typically, retailers sell produce a third cheaper than at the supermarket, and the grower gets 70% of the retail value of sales, given in credit to spend in the shop."
Shop | Covent Garden,https://www.coventgarden.london/shop/,"Shop at Covent Garden Covent Garden is one of London's most popular shopping neighbourhoods, home to a wide range of world-class fashion, beauty and lifestyle stores. From Polo Ralph Lauren to Tom Ford , Mulberry to Tiffany & Co . and Apple to DECIEM , discover a unique blend of global and independent brands designed to satisfy your every ..."
Poundland.co.uk | Amazing value every day,https://www.poundland.co.uk/,"Order by 9pm Mon-Thu, 4pm Fri & 6pm Sat-Sun for next day delivery. Standard delivery just £1 on orders over £50. Shop now pay later available. Shop Online Now. Shop Online Now. Shop Online Now. Shop Online Now. Deals of the Week. Discover incredible online exclusive discounts!"
Tomato Plants - Stillman's Farm,https://stillmansfarm.com/portfolio/tomato-plants/,"This tomato is a family heirloom of Kalman Lajvort of Edison, New Jersey, with the seed originally hailing from Europe. Oval shaped, 8 oz. pink fruits are incredibly meaty with a deep, rich flavor ideal used as a slicer or even as a large, juicy paste type. Plants bear late into the season. Kelloggs Breakfast."
Working with plants - new Law - what you need to know! - Blogger,https://rachel-the-gardener.blogspot.com/2020/01/if-you-sell-plants-you-need-to-know.html,"Never mind, be strong, we will find a way to work together to make things right, but let's start by running through the basics. There are two points to this that need thinking about - selling plants, and working with plants. 1) SELLING PLANTS. This bit affects all of us who sell a few plants as a hobby, as a small off-shoot of our business, to ..."
Buy Nenuco Products | UK shop for Spanish Toiletries - Lemon Fresh UK,https://lemonfreshuk.com/,We are a family run company with family run values. If you have any questions regarding products or delivery you can always give us a call directly to speak to a member of our team who will always be happy to help. You can call us on 01375 800987. Thanks for visiting Lemon Fresh UK today and we really look forward to serving you soon.
Wholesale — Atlas Farm,https://www.atlasfarm.com/wholesale,"Atlas Farm sells the highest quality certified organic produce to wholesale customers throughout New England. We deliver to local grocery stores, produce distributors, grower co-ops, restaurants, and farm stands/CSAs in Western Massachusetts, as well as to select stores in the Boston area. ... Store Phone: 413-397-3587. 218 Greenfield Rd South ..."
30 Small Ornamental Trees (With Pictures) - Identification Guide,https://leafyplace.com/small-ornamental-trees/,"The purple-leaf sand cherry is a small ornamental landscaping tree that adds a burst of color to garden landscapes. The decorative outdoor tree features deep purple-red leaves, fragrant pale pink flowers, and stunning fall colors. Purple-leaf sand cherry trees grow 6 to 10 ft. (1.8 - 3 m) tall and wide."
Shops and Stores in Britain,http://www.projectbritain.com/shops.htm,"In England, most retail shops are generally open 6 or 7 days a week. Typical opening times are: Mondays - Saturdays 9am to 5:30pm Some shopping centres stay open until 8 pm or later. Sunday - 10am to 4pm (or 11am to 5pm) Sunday shopping has become popular in recent years and most large shops in towns are open for business."
Ornamental Corn Seeds - Grow Ornamental Corn - Harris Seeds,https://www.harrisseeds.com/collections/corn-ornamental-corn,"Fresh Market Grower Tips. Halloween has now eclipsed all other holidays as sales leader for the grower-retailer. While pumpkins may be king of the hill, there are a host of other products, including ornamental corn, broom corn, cornstalks, and popcorn, that will bring in additional income to both wholesale and retail markets."
The top 20 retail companies and stores in the UK - Consultancy,https://www.consultancy.uk/news/23822/the-top-20-retail-companies-and-stores-in-the-uk,"The UK retail sector remains on unstable ground in 2020, having seen a rapid and sustained decline over the last decade. A number of retailers continue to outperform the market however, thanks to their ability to provide a differentiated customer experience, appealing products and services and in-demand marketing efforts."
British Food Depot - Shop For British Foods In The USA,https://britishfooddepot.com/,"We serve Expats and lovers of British Food from all over the USA. The British Food Depot is your fast and convenient store offering the lowest priced British foods online. We invite you to browse through our store where you can find a wide range of British foods including English teas, Cadbury chocolate, Mcvities, Walkers Crisps and Ribena to ..."
27 Best Retail Store Design Ideas to Increase Sales - Fit Small Business,https://fitsmallbusiness.com/retail-store-design-ideas/,"They work well for stores selling technology, electronics, and beauty and cosmetics products. 22. Design a Space for Online Orders. Click and collect or buy online, pick up in-store (BOPIS) saw a spike with the onset of the COVID-19 pandemic, and buyers continue to take advantage of this convenient shopping option."
Find a Retailer | Proven Winners,https://www.provenwinners.com/retailers/locate,"Find a Retailer Near You. Can't find the plant you want? Visit Proven Winners® online store or one of these companies that supply some of our plants online: In US: Garden Crossings , Romence Gardens , Park Seed , Wayside Gardens, Bluestone Perennials, Great Garden Plants, JW Jung, Nature Hills, Hirts Gardens, Sooner Plant Farm, Planting Tree ..."
Fresh - University of Bath,https://www.bath.ac.uk/locations/fresh/,"Fresh sells: a wide range of fresh food, including meat, fruit and vegetables. groceries. world food range. household goods. rollover hot dogs. zero waste dry goods in The Refillery. an extensive range of homeware including towels and kitchenware. It also has self service checkouts and a Post Office, where you can:"
"England FA Store, 2024 England National Team Kits | England Lionesses ...",https://www3.englandstore.com/en/,"The Official England Store is the best place to find official England football merchandise. Global shipping means you can have it delivered right to your door, anywhere in the world. Whether it's a 2024 England National Team shirt to represent your team as they compete in Germany or a classic retro look from 1966 or 1996, you can find it here."
Pet Shops - OATA - The Ornamental Aquatic Trade Association,https://ornamentalfish.org/what-we-do/represent-the-industry/pet-shops/,"We estimate there are about 3,000 pet shops in the UK and about 2,000 of these sell fish. We have long campaigned about the lack of consistency with pet shop licensing in the UK. Back in 2013 we worked with the Chartered Institute of Environmental Health and endorsed its guidance to EHOs. Unfortunately this guidance was never mandatory."
Fresh Garbage - The original alternative shop based in Belfast.,https://freshgarbage.co.uk/,"Welcome to Fresh Garbage. Fresh Garbage offer a unique mix of body jewellery, smoking accessories, hair dyes, t-shirts and clothing across Rock, Music, Goth, Punk and alternative themes. Located in Belfast, we are your first choice for body jewellery and much more. You can order online or drop in to our world famous shop on Rosemary Street."
Re-think how you market your ornamental plants - MSU Extension,https://www.canr.msu.edu/news/re-think_how_you_market_your_ornamental_plants,"Low prices convey a message that our products have little value. Participants in the Ohio short course said, At $2.99 we sold a lot but at $4.99 we sold more! Multiple-unit pricing moves more units (3 for $10 versus $3.35 per unit). Think not just about the cost and mark that up, but think about perceived value."
RETAILING QUIZZES Flashcards | Quizlet,https://quizlet.com/505547021/retailing-quizzes-flash-cards/,"Study with Quizlet and memorize flashcards containing terms like Why is it imperative that manufacturers like HP and Procter and Gamble understand the operations of retailers?, Samson's is a large clothing retailer. The store offers over 1,000 brands and 50,000 different products. Which of the following value-creating activities can best be seen in the given example?, Fresh n Fragrant is a ..."
Partner for pet shops | Ruinemans Aquarium,https://www.ruinemansgroup.com/homepage-en,"Ruinemans Group: Partner for the pet specialty store. Since 1955, small and large retailers know where to find us when it comes to top quality fish. Due to our long experience we have acquired great knowledge in importing and exporting tropical fish. We import our fish from 25 countries, including the US, Brazil and Asia."
Happy Houseplants | Shop Low Priced Indoor Plants | Buy Plants Now!,https://www.happyhouseplants.co.uk/,"Transform your home into a lush green oasis with Happy Houseplants! Discover our wide selection of RHS Chelsea gold winning indoor houseplants, delivered right to your doorstep in the UK. Explore our extensive range of low priced, large and tall plants, low light varieties, rare houseplants, and easy-care plants."
A Grower's Guide to Selling Cut Flowers at the Farmer's Market,https://morningchores.com/selling-cut-flowers/,What Makes a Great Flower For Selling. Here's what makes a good farmer's market flower: Lifespan - you want varieties that hold up in a vase for at least a week. Height - tall varieties over 14 inches are best. Climate - pick varieties that grow well in your climate. Variety - don't just grow the flowers that jump out at you with ...
